{
  "id": "01a8c013-70af-4272-9dbb-bf9f86b2bcd5",
  "contentDocumentVersion": "1.0",
  "shipmentPackageId": "b9d3552d-f95a-4658-8f44-9d9c20a858de",
  "auditInfo": {
    "createdDate": "2021-12-12T19:24:05Z",
    "createdBy": "Application Admin",
    "updatedDate": "2021-12-12T19:24:05Z",
    "updatedBy": "Application Admin",
    "isDeleted": false
  }
}